Speaker,DialogAct,Text
D,Minor,"Yeah comm but but if we ca "
A,Task,"I've never seen it before in a remote control . "
D,Minor,"I don't know if "
B,Task,"But then we could make a docking station . "
D,Task,"Five minutes . "
A,Task,"No comm we we we can't make a docking station anyway . "
D,Task,"That's not true . "
A,Task,"Yeah comm we can als or uh also m we we can make one "
D,Task,"We can make a docking station for two thirty . "
B,Minor,"Wow comm w why no li "
A,Task,"we can still make "
B,Task,"Look at now comm we got two "
D,Task,"Two thirty . "
C,Task,"Fo for a docking station . "
B,Task,"two thirty left . "
D,Task,"We can make a docking station . Sure . "
B,Elicit,"Ca can't we make a docking station of that ? "
C,Elicit,"With a cable comm with uh buttons on it comm with retrieval uh device in it . "
D,Task,"Sure . "
B,Task,"I don't know . "
D,Task,"The power device is is i i is very cheap . "
D,Task,"That's just a regular uh power cable and whatever . "
A,Task,"Yeah comm but be serious comm then uh the docking station will be a fifth of the price of the remote control . "
C,Minor,"Wi with a button to "
B,Minor,"Well comm we we uh "
D,Task,"So . "
C,Task,"wi with a button to retrieve it comm so it will beep . "
C,Task,"Uh comm so it's uh wireless technology . "
D,Minor,"Yeah . "
A,Task,"Yeah comm "
A,Task,"but we uh we don't inc we haven't looked at the these costs of the speaker and other stuff . "
A,Task,"I don't think it's realistic for you to do so . "
D,Task,"Well then it's a useless project . "
C,Task,"Look at the case comm "
A,Minor,"Oh comm because we "
C,Minor,"the case the case of of uh of uh "
B,Task,"Yeah comm then we don't have any innovation things . "
A,Task,"We well look at all the special stuff we have . "
A,Task,"Colour a the colours are special comm the form is special . "
A,Task,"It th this is whole concept . "
A,Task,"Uh maybe it with the kinetic thing comm I think we could do uh do a compromise uh with the kim kinetic thing . "
D,Minor,"Can't we uh "
D,Task,"Can't we say fifteen Euros ? "
D,Minor,"No comm sta yeah I mean "
A,Task,"Uh comm no . "
C,Task,"No comm then we have to sell it for thirty Euros . "
D,Task,"No . "
B,Task,"No comm we only make less profit of it . "
C,Minor,"It's the "
D,Task,"You can sell for twenty seven and a half . "
D,Task,"Then you make as much profit as you would with twelve and a half production costs . "
B,Minor,"No . "
A,Minor,"Yeah comm I don "
A,Task,"my suggestion is to just forget about the whole docking station thing "
A,Minor,"and make it uh like a "
A,Minor,"Uh uh I I I I still fee "
A,Task,"I also feel this concept of making it kinetic comm "
A,Task,"because of the you know comm it g it gives something dynamic to the remote control . "
D,Minor,"I don't think "
C,Task,"Maybe we can uh can do it both . "
C,Task,"Maybe we can do it both uh in the in the in the remote . Battery and kinetic . "
D,Task,"No . "
A,Task,"No comm that wouldn't n no . "
D,Task,"Thirteen twenty . "
A,Minor,"Yeah comm and it is also not a good it's not "
A,Task,"you have to really do it only kinetic comm you don't want it to think about batteries anymore . "
D,Minor,"And I think only "
C,Minor,"Yes comm but when it's then when it "
D,Minor,"Yeah comm but only kinetic comm then you gotta "
A,Minor,"No no . "
C,Task,"then you have to shake it uh and all when it's when it's empty . "
A,Task,"Yeah comm it's great . "
D,Task,"You you gotta throw uh throw it through the room like twenty times an hour comm really . "
A,Task,"No no no . "
A,Task,"No no comm this is very sophisticated technology technology . "
A,Task,"When you use it your remote like once a day comm or maybe even less i i it "
C,Minor,"You asked for three d "
C,Task,"No comm that's n that's not true . "
C,Task,"Uh comm a watch is uh kinetic because you walk all the time . "
D,Minor,"No . "
A,Minor,"It We can make it yeah no . "
A,Minor,"Becau be but a remote control gets "
A,Task,"why do they state that this technology can be used if it "
C,Task,"Yes comm solar cells are also stated . "
A,Task,"Yeah comm m but a w uh uh n uh a calculator also works on r on solar cells . "
C,Task,"Why don't we use solar cells then ? "
A,Task,"Because I think the d whole dynamic part comm do you know comm appeals to me qui uh thinking of our design philosophy comm you know comm "
A,Task,"with the rubber parts and uh sturdiness of the thing comm and y when you move it around a lot comm then people find the idea funny that when I move my remote control around and "
C,Task,"That's true . "
D,Task,"Yeah comm it's funny for a week . "
D,Task,"I guess something like that comm where you have to move it around very frequently comm is demotivating . "
A,Task,"Yeah comm but you don't have to . "
A,Other,"Trust me . "
A,Task,"The idea of this technology is that you don't think about it comm it just happens . "
D,Task,"No comm I I don't move my uh my remote control very much comm seriously . "
A,Task,"Okay comm then we d Okay comm well y we don't have to do it comm but what that would just have a lack of key features comm you know . "
C,Minor,"Oui . "
A,Task,"You m have to put something on your box . "
A,Task,"You have to make people buy it and uh "
A,Task,"We can really can do the docking thing comm "
A,Minor,"uh it's not "
A,Task,"yeah comm uh we can do it comm but it's would be a easy way out . "
C,Other,"You can do it for fifty cents . "
D,Task,"Well comm we've got more than fifty Cents . "
C,Minor,"The c The case the case alone is is is uh "
A,Task,"Okay comm but we have to grou to agree upon something comm "
A,Task,"because uh we only have a minute left or so . "
C,Task,"the case alone for uh remote control is at least one Euro . "
C,Task,"Then we have one Euro thirty for the whole docking station . "
A,Task,"No no comm it's not possible . "
A,Task,"Okay comm w b we can s we can leave it on "
A,Minor,"be well then then th it's this is "
A,Task,"then then our concept is ready . "
B,Task,"Cheap remote control . "
A,Task,"Yeah comm we make some extra profit of it . "
D,Task,"Yeah . No comm we won't comm but that's um something else . "
C,Minor,"But now "
D,Task,"No comm this not gonna sell . No . "
B,Task,"It w it won't tell comm but "
A,Elicit,"Huh comm any ideas ? "
D,Task,"Of course not . "
B,Task,"No comm uh comm n no "
C,Task,"Great . It's great . "
B,Task,"Yeah comm we just have to go all what we did today again . You have to do it over . "
C,Task,"Our remote control . "
D,Task,"We come back tomorrow comm okay ? "
B,Task,"Yeah . "
A,Task,"No no uh there's still there's still someth concept and something special left . "
C,Minor,"Yes . "
B,Minor,"the "
C,Other,"Seventy Euros . "
A,Minor,"I mean we're gonna "
A,Task,"it's gonna excel in in on in the the range in the field of design and and uh looks and feel . "
B,Task,"No comm but no . "
A,Task,"That's what it's makes it special . "
A,Task,"Yeah comm and I would li I would have liked a kinetic part as well comm to give it some just to give it some extra special feature comm "
A,Task,"and uh I know it will work comm "
A,Minor,"but uh it's it's an "
A,Task,"They're they're not putting technologies on this comm but if it if it was impossible to to make it happen . "
C,Elicit,"Why not a hand dynamo then ? "
A,Task,"Okay comm well we leave it like this . "
A,Minor,"Then it's c then we're yeah . "
B,Task,"Yeah comm yeah . "
D,Task,"We can't do anything else . "
D,Task,"Warning comm finish meeting now . "
C,Task,"We're done . "
A,Minor,"Okay comm project e uh "
C,Elicit,"Is this it ? "
A,Task,"well comm we were gonna what look take a look at the last sheet . "
D,Task,"Yeah comm sure . "
C,Task,"Okay . "
D,Task,"No comm we can't . "
A,Task,"Yeah comm we have to Yeah comm it's "
B,Minor,"No . "
D,Task,"Yes comm yes . Celebration . "
C,Minor,"Yes . "
D,Task,"I don't see why comm but "
C,Other,"Where's the champagne ? "
D,Task,"I think we gotta fill out another questionnaire comm to be honest . "
B,Elicit,"Yeah ? "
C,Task,"I don't uh hear a bell . "
D,Task,"No comm not yet . "
D,Task,"Alright comm I'll see you guys in a minute . "
B,Task,"We can do it here then . "
C,Other,"Bye . "
D,Task,"I don't think so . "
B,Minor,"Can we "
B,Elicit,"can't we do it here ? "
D,Task,"I don't know . I don't I don't think so . "
C,Minor,"Uh-huh . "
C,Other,"Just fill that one in . "
B,Task,"Yeah comm we're doing now . "
B,Minor,"But it's . "
B,Task,"Oh comm okay . "
A,Task,"Uh comm I don't know . "
B,Task,"Nice . "
